Продукт,Калорийность,Белки,Жиры,Углеводы"Фуа-гра, консервированная гусиная печень, копченная",462 кКал,"11,4 г","43,84 г","4,67 г"
Цесарка,158 кКал,"23,4 г","6,45 г",0 г
"Цесарка, только мясо",110 кКал,"20,64 г","2,47 г",0 г
"Цыплята жареные, по 2-14",261 кКал,24 г,"18,3 г","0,1 г"
"Цыплята отварные, по 2-4",211 кКал,"21,1 г","13,6 г",0 г
"Цыплята табака жареные, по 2-20",281 кКал,"24,8 г","20,2 г","0,1 г"
"Эму, верхняя часть филе, жареное на огне",152 кКал,"29,07 г","3,13 г",0 г
"Эму, внутрення часть голени",108 кКал,"22,22 г","1,49 г",0 г
"Эму, внутрення часть голени, жареная на огне",156 кКал,"32,38 г","2,01 г",0 г
"Эму, мышца-подниматель хвоста, жареное на огне",154 кКал,"31,27 г","2,3 г",0 г
"Эму, мышца-подниматель хвоста, сырое",103 кКал,"22,5 г","0,8 г",0 г
"Эму, наружная часть голени",103 кКал,"23,08 г","0,48 г",0 г
"Эму, нежное мясо спины, сырое",141 кКал,"22,81 г","4,86 г",0 г
"Эму, огузок",112 кКал,"22,83 г","1,64 г",0 г
"Эму, огузок, жареный на огне",168 кКал,"33,67 г","2,68 г",0 г
"Эму, плоское филе, сырое",102 кКал,"22,25 г","0,74 г",0 г
"Эму, фарш",134 кКал,"22,77 г","4,03 г",0 г
"Эму, фарш, жареный на сковороде",163 кКал,"28,43 г","4,65 г",0 г
