Продукт,Калорийность,Белки,Жиры,Углеводы"Чай, растворимый, неподслащенный, порошок",315 кКал,"20,21 г",0 г,"50,16 г"
"Чай, растворимый, неподслащенный, порошок, без кофеина",315 кКал,"20,21 г",0 г,"50,16 г"
"Чай, растворимый, подслащенный сахарином натрия, со вкусом лимона, порошок",338 кКал,"3,3 г","0,6 г","85,4 г"
"Чай, растворимый, подслащенный сахарином натрия, со вкусом лимона, порошок, без кофеина",338 кКал,"3,3 г","0,6 г","85,4 г"
"Чай, растворимый, подслащенный сахарином натрия, со вкусом лимона, порошок, приготовленный",2 кКал,"0,02 г",0 г,"0,44 г"
"Чай, растворимый, подслащенный сахаром, со вкусом лимона, с доб. аскорбиновой кислоты, порошок",385 кКал,"0,6 г","0,3 г","97,6 г"
"Чай, растворимый, с сахаром, со вкусом лимона, без доб. аскорбиновой кислоты, порошок",401 кКал,"0,12 г","0,73 г","97,85 г"
"Чай, растворимый, с сахаром, со вкусом лимона, без доб. аскорбиновой кислоты, порошок, без кофеина",401 кКал,"0,12 г","0,73 г","98,55 г"
"Чай, растворимый, с сахаром, со вкусом лимона, без доб. аскорбиновой кислоты, порошок, приготовленный",35 кКал,"0,01 г","0,06 г","8,51 г"
"Чай, травяной, не ромашковый, заваренный",1 кКал,0 г,0 г,"0,2 г"
"Чай, травяной, ромашковый, заваренный",1 кКал,0 г,0 г,"0,2 г"
Черноплодно-рябиновый сок,50 кКал,"0,1 г","0,1 г","11,4 г"
Черносмородиновый сок,41 кКал,"0,5 г",0 г,"7,3 г"
Шиповниковый сок,67 кКал,"0,1 г","0,2 г","16,1 г"
Шоколадный сироп,279 кКал,"2,1 г","1,13 г","62,5 г"
"Шоколадный сироп, приготовленный на цельном молоке",90 кКал,"3,07 г","2,96 г","12,48 г"
"Энергетический напиток, AMP",46 кКал,"0,25 г","0,08 г","12,08 г"
"Энергетический напиток, AMP, без сахара",2 кКал,0 г,0 г,"1,03 г"
"Энергетический напиток, FULL THROTTLE",46 кКал,"0,25 г","0,08 г","12,08 г"
"Энергетический напиток, Monster (Монстр)",47 кКал,"0,47 г",0 г,"11,28 г"
"Энергетический напиток, RED BULL (Ред булл), с доб кофеина, витаминами: PP, B5, B6 и B12",43 кКал,"0,46 г",0 г,"10,23 г"
"Энергетический напиток, ROCKSTAR",58 кКал,"0,34 г","0,22 г","12,7 г"
"Энергетический напиток, ROCKSTAR, без сахара",4 кКал,"0,25 г","0,08 г","0,7 г"
"Энергетический напиток, VAULT Zero, без сахара, со вкусом цитрусовых",1 кКал,"0,25 г","0,08 г","0,7 г"
"Энергетический напиток, VAULT Zero, со вкусом цитрусовых",49 кКал,0 г,0 г,"12,99 г"
Яблочно морковный напиток. Консервы,68 кКал,"0,3 г",0 г,"15,5 г"
Яблочно-абрикосовый напиток. Консервы,58 кКал,"0,2 г",0 г,14 г
Яблочно-виноградный напиток,52 кКал,"0,3 г",0 г,"12,3 г"
