Продукт,Калорийность,Белки,Жиры,Углеводы"Пшеничная мука высшего сорта, универсальная, обогащенная, неотбеленная",364 кКал,"10,33 г","0,98 г","73,61 г"
"Пшеничная мука высшего сорта, универсальная, обогащенная, отбеленная",364 кКал,"10,33 г","0,98 г","73,61 г"
"Пшеничная мука высшего сорта, универсальная, обогащенная, самоподнимающаяся",354 кКал,"9,89 г","0,97 г","71,52 г"
"Пшеничная мука высшего сорта, хлебопекарная, обогащенная",361 кКал,"11,98 г","1,66 г","70,13 г"
Пшеничная мука цельнозерновая,340 кКал,"13,21 г","2,5 г","61,27 г"
Пшеничная мука цельнозерновая из мягкой пшеницы,332 кКал,"9,61 г","1,95 г","61,38 г"
"Пшеничная мука, второго сорта",324 кКал,"11,7 г","1,81 г","63,7 г"
"Пшеничная мука, высшего сорта",334 кКал,"10,8 г","1,3 г","69,9 г"
"Пшеничная мука, высшего сорта, витаминизированная",334 кКал,"10,3 г","1,1 г","68,9 г"
"Пшеничная мука, обойная",312 кКал,"11,5 г","2,2 г","61,5 г"
"Пшеничная мука, первого сорта",329 кКал,"11,1 г","1,5 г","67,8 г"
"Пшеничная мука, первого сорта, витаминизированная",331 кКал,"10,6 г","1,3 г","67,6 г"
"Пшеничная мука, хлебопекарная, необогащенная",361 кКал,"11,98 г","1,66 г","70,13 г"
"Пшеничные зародыши, сырые",360 кКал,"23,15 г","9,72 г","38,6 г"
Пшеничные отруби,165 кКал,16 г,"3,8 г","16,6 г"
"Пшеничные отруби, сырые",216 кКал,"15,55 г","4,25 г","21,71 г"
Пшенная каша по 1-278,109 кКал,"2,8 г","3,4 г","16,8 г"
"Пшенная крупа, пшено шлифованное",342 кКал,"11,5 г","3,3 г","66,5 г"
Пшенная мука,382 кКал,"10,75 г","4,25 г","71,62 г"
Пшено (просо) воздушное,354 кКал,13 г,"3,4 г","77,3 г"
"Пшено, приготовленное",119 кКал,"3,51 г",1 г,"22,37 г"
"Пшено, сырое",378 кКал,"11,02 г","4,22 г","64,35 г"
"Ржаная мука, обдирная",298 кКал,"8,9 г","1,7 г","61,8 г"
"Ржаная мука, обдирная",349 кКал,"10,88 г","1,52 г","63,63 г"
"Ржаная мука, обойная",294 кКал,"10,7 г","1,9 г","58,5 г"
"Ржаная мука, обойная",325 кКал,"15,91 г","2,22 г","44,83 г"
"Ржаная мука, сеяная",305 кКал,"6,9 г","1,4 г","66,3 г"
"Ржаная мука, сеяная",357 кКал,"9,82 г","1,33 г","68,68 г"
Ржаные отруби,"114,2 кКал","12,2 г","3,4 г","8,7 г"
"Рис белый длиннозерный, быстроразваривающийся, обогащенный, приготовленный",124 кКал,"2,18 г","0,5 г","26,16 г"
"Рис белый длиннозерный, быстроразваривающийся, обогащенный, сухой",380 кКал,"7,82 г","0,94 г","80,42 г"
"Рис белый длиннозерный, обогащенный, приготовленный",130 кКал,"2,69 г","0,28 г","27,77 г"
"Рис белый длиннозерный, обогащенный, приготовленный с солью",130 кКал,"2,69 г","0,28 г","27,77 г"
"Рис белый длиннозерный, обогащенный, сухой",365 кКал,"7,13 г","0,66 г","78,65 г"
"Рис белый длиннозерный, приготовленный без соли",130 кКал,"2,69 г","0,28 г","27,77 г"
"Рис белый длиннозерный, приготовленный с солью",130 кКал,"2,69 г","0,28 г","27,77 г"
"Рис белый длиннозерный, пропаренный, обогащенный, приготовленный",123 кКал,"2,91 г","0,37 г","25,15 г"
"Рис белый длиннозерный, пропаренный, обогащенный, сухой",374 кКал,"7,51 г","1,03 г","79,09 г"
"Рис белый длиннозерный, пропаренный, приготовленный",123 кКал,"2,91 г","0,37 г","25,15 г"
"Рис белый длиннозерный, сухой",365 кКал,"7,13 г","0,66 г","78,65 г"
"Рис белый длиннозерный, сухой",374 кКал,"7,51 г","1,03 г","79,09 г"
"Рис белый клейкий (азиатский), приготовленный",97 кКал,"2,02 г","0,19 г","20,09 г"
"Рис белый клейкий (азиатский), сухой",370 кКал,"6,81 г","0,55 г","78,88 г"
"Рис белый короткозерный, обогащенный, приготовленный",130 кКал,"2,36 г","0,19 г","28,73 г"
"Рис белый короткозерный, обогащенный, сухой",358 кКал,"6,5 г","0,52 г","76,35 г"
"Рис белый короткозерный, приготовленный",130 кКал,"2,36 г","0,19 г","28,73 г"
"Рис белый короткозерный, сухой",358 кКал,"6,5 г","0,52 г","79,15 г"
Рис белый приготовленный на пару (Китайская кухня),151 кКал,"3,2 г","0,27 г","32,98 г"
"Рис белый среднезерный, обогащенный, приготовленный",130 кКал,"2,38 г","0,21 г","28,29 г"
"Рис белый среднезерный, обогащенный, сухой",360 кКал,"6,61 г","0,58 г","77,94 г"
"Рис белый среднезерный, приготовленный",130 кКал,"2,38 г","0,21 г","28,59 г"
"Рис белый среднезерный, сухой",360 кКал,"6,61 г","0,58 г","79,34 г"
"Рис белый, крупа рисовая",333 кКал,7 г,1 г,74 г
"Рис дикий (черный, индейский рис, цициания), приготовленный",101 кКал,"3,99 г","0,34 г","19,54 г"
"Рис дикий (черный, индейский рис, цициания), сухой",357 кКал,"14,73 г","1,08 г","68,7 г"
"Рис желтый со специями, сухая смесь",343 кКал,"7,02 г","1,75 г","72,88 г"
"Рис коричневый (нешлифованный) длиннозерный, приготовленный",123 кКал,"2,74 г","0,97 г","23,98 г"
"Рис коричневый (нешлифованный) длиннозерный, сухой",367 кКал,"7,54 г","3,2 г","72,65 г"
"Рис коричневый (нешлифованный) среднезерный, приготовленный",112 кКал,"2,32 г","0,83 г","21,71 г"
"Рис коричневый (нешлифованный) среднезерный, сухой",362 кКал,"7,5 г","2,68 г","72,77 г"
"Рис коричневый (нешлифованный), пропаренный, приготовленный, UNCLE BENS",147 кКал,"3,09 г","0,85 г","29,63 г"
"Рис коричневый (нешлифованный), пропаренный. сухой, UNCLE BEN'S",370 кКал,"7,6 г","2,75 г","75,18 г"
"Рис крем, дроблёный рис быстрорастворимый, приготовленный на воде с солью",52 кКал,"0,9 г","0,1 г","11,4 г"
"Рис крем, дроблёный рис быстрорастворимый, сухой",370 кКал,"6,3 г","0,5 г","81,7 г"
"Рис, зерно цельное необработанное",303 кКал,"7,5 г","2,6 г","62,3 г"
Рисовая запеканка по 1-288,144 кКал,4 г,"5,6 г","19,4 г"
Рисовая запеканка с творогом по 1-288,189 кКал,"5,1 г","7,1 г","26,1 г"
Рисовая каша по 1-268,144 кКал,"2,4 г","3,5 г","25,8 г"
"Рисовая лапша, приготовленная",108 кКал,"1,79 г","0,2 г","23,01 г"
"Рисовая лапша, сухая",364 кКал,"5,95 г","0,56 г","78,58 г"
Рисовая мука диетическая,356 кКал,"7,4 г","0,6 г","80,2 г"
"Рисовая мука, белая",366 кКал,"5,95 г","1,42 г","77,73 г"
"Рисовая мука, коричневая",363 кКал,"7,23 г","2,78 г","71,88 г"
"Рисовые отруби, сырые",316 кКал,"13,35 г","20,85 г","28,69 г"
Рожь молотая жареная,322 кКал,"7,9 г","1,7 г","68,7 г"
"Рожь, зерно",338 кКал,"10,34 г","1,63 г","60,76 г"
"Рожь, зерно цельное необработанное",283 кКал,"9,9 г","2,2 г","55,8 г"
Сорго,323 кКал,"10,6 г","4,12 г","59,6 г"
Сорго,329 кКал,"10,62 г","3,46 г","65,39 г"
"Спагетти со шпинатом, приготовленные",130 кКал,"4,58 г","0,63 г","26,15 г"
"Спагетти со шпинатом, сухие",372 кКал,"13,35 г","1,57 г","64,21 г"
"Спагетти, обогащенные протеином, приготовленные",164 кКал,"8,86 г","0,21 г","28,88 г"
"Спагетти, обогащенные протеином, сухие",374 кКал,"21,78 г","2,23 г","63,25 г"
"Сухой завтрак,  MALT-O-MEAL, обычный, сухой",361 кКал,"11,8 г","1,27 г","75,6 г"
"Сухой завтрак, CREAM OF WHEAT, обычный, приготовленный на воде, без соли",50 кКал,"1,44 г","0,21 г","10,52 г"
"Сухой завтрак, CREAM OF WHEAT, обычный, сухой",370 кКал,"10,5 г","1,5 г","76,5 г"
"Сухой завтрак, готовый к употреблению, GENERAL MILLS TOTAL, Cranberry Crunch",328 кКал,"6,9 г","1,72 г",78 г
"Сухой завтрак, готовый к употреблению, GENERAL MILLS, Curves Fruit & Nut Crunch cereal",347 кКал,"6,12 г","3,06 г","85,44 г"
"Сухой завтрак, готовый к употреблению, GENERAL MILLS, DORA THE EXPLORER",366 кКал,"5,6 г","5,7 г","82,8 г"
"Сухой завтрак, готовый к употреблению, GENERAL MILLS, Fruity CHEERIOS",383 кКал,"5,2 г","5,2 г","84,2 г"
"Сухой завтрак, готовый к употреблению, GENERAL MILLS, OATMEAL CRISP with Almonds",393 кКал,"9,8 г","6,7 г","78,9 г"
"Сухой завтрак, готовый к употреблению, KELLOGG'S SPECIAL K Chocolatey Delight",381 кКал,"6,5 г","7,3 г","81,2 г"
"Сухой завтрак, готовый к употреблению, QUAKER, QUAKER OAT CINNAMON LIFE",373 кКал,"9,01 г","4,05 г","79,16 г"
"Сухой завтрак, готовый к употреблению, WEETABIX WHOLE WHEAT CEREAL",373 кКал,"11,5 г","2,8 г","77,4 г"
"Сухой завтрак, готовый к употреблению, воздушная пшеница подслащенная, любой бренд",390 кКал,"5,8 г","1,3 г","90,7 г"
"Сухой завтрак, готовый к употреблению, колца со вкусом шоколада, подслащенные, любой бренд",415 кКал,"4,8 г","8,8 г","81,9 г"
"Сухой завтрак, готовый к употреблению, овес и кукуруза и пшеница, квадратики, подслащенные, с кленовым вкусом",430 кКал,6 г,"9,8 г","79,9 г"
"Сухой завтрак, готовый к употреблению, пшеница, дробленная, обычная, без сахара и соли",337 кКал,"11,37 г","2,21 г","78,76 г"
"Сухой завтрак, фарина, крахмал, картофельная мука, обогащенная, приготовленная на воде, без соли",53 кКал,"1,82 г","0,34 г","10,92 г"
"Тапиока (маниоковое саго), сухая",358 кКал,"0,19 г","0,02 г","87,79 г"
"Тефф, неприготовленный",367 кКал,"13,3 г","2,38 г","65,13 г"
"Тефф, приготовленный",101 кКал,"3,87 г","0,65 г","17,06 г"
Толокно,363 кКал,"12,5 г",6 г,"64,9 г"
Тритикале,336 кКал,"13,05 г","2,09 г","72,13 г"
Тритикале,293 кКал,"12,8 г","2,08 г","54,5 г"
"Хомини кукуруза (никстамализированная) белая, консервированная",72 кКал,"1,48 г","0,88 г","11,76 г"
"Хомини кукуруза (никстамализированная), желтая, консервированная",72 кКал,"1,48 г","0,88 г","11,76 г"
Ячменная мука,284 кКал,10 г,"1,6 г","56,1 г"
Ячменная мука или крупка,345 кКал,"10,5 г","1,6 г","64,42 г"
Ячменный солод,361 кКал,"10,28 г","1,84 г","71,2 г"
Ячмень вылущенный,354 кКал,"12,48 г","2,3 г","56,18 г"
"Ячмень, зерно цельное необработанное",288 кКал,"10,3 г","2,4 г","56,4 г"
Ячневая каша по 1-278,96 кКал,"2,1 г","2,9 г","15,3 г"
Ячневая крупа,313 кКал,10 г,"1,3 г","65,4 г"
